{
  "$schema": "https://json-schema.org/draft/2020-12/schema",
  "$id": "https://killweb.game/research/schemas/country_dossier.schema.json",
  "title": "KillWeb Country Dossier Manifest",
  "type": "object",
  "required": [
    "schema_version",
    "country_id",
    "country_code",
    "name",
    "bookmark_id",
    "as_of",
    "depth_tier",
    "coverage_status",
    "roster_basis",
    "coverage",
    "dataset_paths",
    "completeness",
    "source_ids",
    "unknowns"
  ],
  "properties": {
    "schema_version": {
      "type": "string",
      "pattern": "^\\d+\\.\\d+\\.\\d+$"
    },
    "country_id": {
      "$ref": "common.schema.json#/$defs/stableId"
    },
    "country_code": {
      "type": "string",
      "pattern": "^[A-Z]{3}$"
    },
    "name": {
      "type": "string",
      "minLength": 1
    },
    "bookmark_id": {
      "$ref": "common.schema.json#/$defs/stableId"
    },
    "as_of": {
      "$ref": "common.schema.json#/$defs/isoDateOrTimestamp"
    },
    "depth_tier": {
      "type": "string",
      "enum": [
        "A",
        "B",
        "C",
        "D"
      ]
    },
    "coverage_status": {
      "type": "string",
      "enum": [
        "shell",
        "collecting",
        "needs_review",
        "verified",
        "stale",
        "deprecated"
      ]
    },
    "roster_basis": {
      "type": "string",
      "enum": [
        "top_80_2025_nominal_gdp",
        "mandatory_strategic_addition"
      ]
    },
    "gdp_rank": {
      "type": [
        "integer",
        "null"
      ],
      "minimum": 1,
      "maximum": 80
    },
    "gdp_2025_usd_billions": {
      "type": [
        "number",
        "null"
      ],
      "minimum": 0
    },
    "coverage": {
      "type": "object",
      "required": [
        "politics_and_institutions",
        "economy_trade_finance_resources",
        "military_organization_inventory",
        "fixed_facilities_basing",
        "strategic_industry_conversion",
        "energy_transport_communications_logistics",
        "geography_provinces_terrain",
        "crises_alliances_sanctions_deployments"
      ],
      "properties": {
        "politics_and_institutions": {
          "type": "object",
          "required": [
            "status",
            "record_count",
            "source_count",
            "open_question_count"
          ],
          "properties": {
            "status": {
              "type": "string",
              "enum": [
                "shell",
                "collecting",
                "needs_review",
                "verified",
                "stale",
                "deprecated"
              ]
            },
            "record_count": {
              "type": "integer",
              "minimum": 0
            },
            "source_count": {
              "type": "integer",
              "minimum": 0
            },
            "open_question_count": {
              "type": "integer",
              "minimum": 0
            },
            "notes": {
              "type": "string"
            }
          },
          "additionalProperties": false
        },
        "economy_trade_finance_resources": {
          "type": "object",
          "required": [
            "status",
            "record_count",
            "source_count",
            "open_question_count"
          ],
          "properties": {
            "status": {
              "type": "string",
              "enum": [
                "shell",
                "collecting",
                "needs_review",
                "verified",
                "stale",
                "deprecated"
              ]
            },
            "record_count": {
              "type": "integer",
              "minimum": 0
            },
            "source_count": {
              "type": "integer",
              "minimum": 0
            },
            "open_question_count": {
              "type": "integer",
              "minimum": 0
            },
            "notes": {
              "type": "string"
            }
          },
          "additionalProperties": false
        },
        "military_organization_inventory": {
          "type": "object",
          "required": [
            "status",
            "record_count",
            "source_count",
            "open_question_count"
          ],
          "properties": {
            "status": {
              "type": "string",
              "enum": [
                "shell",
                "collecting",
                "needs_review",
                "verified",
                "stale",
                "deprecated"
              ]
            },
            "record_count": {
              "type": "integer",
              "minimum": 0
            },
            "source_count": {
              "type": "integer",
              "minimum": 0
            },
            "open_question_count": {
              "type": "integer",
              "minimum": 0
            },
            "notes": {
              "type": "string"
            }
          },
          "additionalProperties": false
        },
        "fixed_facilities_basing": {
          "type": "object",
          "required": [
            "status",
            "record_count",
            "source_count",
            "open_question_count"
          ],
          "properties": {
            "status": {
              "type": "string",
              "enum": [
                "shell",
                "collecting",
                "needs_review",
                "verified",
                "stale",
                "deprecated"
              ]
            },
            "record_count": {
              "type": "integer",
              "minimum": 0
            },
            "source_count": {
              "type": "integer",
              "minimum": 0
            },
            "open_question_count": {
              "type": "integer",
              "minimum": 0
            },
            "notes": {
              "type": "string"
            }
          },
          "additionalProperties": false
        },
        "strategic_industry_conversion": {
          "type": "object",
          "required": [
            "status",
            "record_count",
            "source_count",
            "open_question_count"
          ],
          "properties": {
            "status": {
              "type": "string",
              "enum": [
                "shell",
                "collecting",
                "needs_review",
                "verified",
                "stale",
                "deprecated"
              ]
            },
            "record_count": {
              "type": "integer",
              "minimum": 0
            },
            "source_count": {
              "type": "integer",
              "minimum": 0
            },
            "open_question_count": {
              "type": "integer",
              "minimum": 0
            },
            "notes": {
              "type": "string"
            }
          },
          "additionalProperties": false
        },
        "energy_transport_communications_logistics": {
          "type": "object",
          "required": [
            "status",
            "record_count",
            "source_count",
            "open_question_count"
          ],
          "properties": {
            "status": {
              "type": "string",
              "enum": [
                "shell",
                "collecting",
                "needs_review",
                "verified",
                "stale",
                "deprecated"
              ]
            },
            "record_count": {
              "type": "integer",
              "minimum": 0
            },
            "source_count": {
              "type": "integer",
              "minimum": 0
            },
            "open_question_count": {
              "type": "integer",
              "minimum": 0
            },
            "notes": {
              "type": "string"
            }
          },
          "additionalProperties": false
        },
        "geography_provinces_terrain": {
          "type": "object",
          "required": [
            "status",
            "record_count",
            "source_count",
            "open_question_count"
          ],
          "properties": {
            "status": {
              "type": "string",
              "enum": [
                "shell",
                "collecting",
                "needs_review",
                "verified",
                "stale",
                "deprecated"
              ]
            },
            "record_count": {
              "type": "integer",
              "minimum": 0
            },
            "source_count": {
              "type": "integer",
              "minimum": 0
            },
            "open_question_count": {
              "type": "integer",
              "minimum": 0
            },
            "notes": {
              "type": "string"
            }
          },
          "additionalProperties": false
        },
        "crises_alliances_sanctions_deployments": {
          "type": "object",
          "required": [
            "status",
            "record_count",
            "source_count",
            "open_question_count"
          ],
          "properties": {
            "status": {
              "type": "string",
              "enum": [
                "shell",
                "collecting",
                "needs_review",
                "verified",
                "stale",
                "deprecated"
              ]
            },
            "record_count": {
              "type": "integer",
              "minimum": 0
            },
            "source_count": {
              "type": "integer",
              "minimum": 0
            },
            "open_question_count": {
              "type": "integer",
              "minimum": 0
            },
            "notes": {
              "type": "string"
            }
          },
          "additionalProperties": false
        }
      },
      "additionalProperties": false
    },
    "dataset_paths": {
      "type": "object",
      "required": [
        "government",
        "political_actors",
        "provinces",
        "economy",
        "force_ledger",
        "facilities",
        "infrastructure",
        "relationships",
        "claims",
        "sources",
        "contradictions"
      ],
      "properties": {
        "government": {
          "type": [
            "string",
            "null"
          ]
        },
        "political_actors": {
          "type": [
            "string",
            "null"
          ]
        },
        "provinces": {
          "type": [
            "string",
            "null"
          ]
        },
        "economy": {
          "type": [
            "string",
            "null"
          ]
        },
        "force_ledger": {
          "type": [
            "string",
            "null"
          ]
        },
        "facilities": {
          "type": [
            "string",
            "null"
          ]
        },
        "infrastructure": {
          "type": [
            "string",
            "null"
          ]
        },
        "relationships": {
          "type": [
            "string",
            "null"
          ]
        },
        "claims": {
          "type": [
            "string",
            "null"
          ]
        },
        "sources": {
          "type": [
            "string",
            "null"
          ]
        },
        "contradictions": {
          "type": [
            "string",
            "null"
          ]
        }
      },
      "additionalProperties": false
    },
    "completeness": {
      "type": "object",
      "required": [
        "political_actor_target",
        "political_actor_count",
        "province_layer_status",
        "force_ledger_status"
      ],
      "properties": {
        "political_actor_target": {
          "type": "integer",
          "minimum": 0
        },
        "political_actor_count": {
          "type": "integer",
          "minimum": 0
        },
        "province_layer_status": {
          "type": "string",
          "enum": [
            "absent",
            "shell",
            "collecting",
            "needs_review",
            "verified",
            "stale"
          ]
        },
        "force_ledger_status": {
          "type": "string",
          "enum": [
            "absent",
            "shell",
            "collecting",
            "needs_review",
            "reconciled",
            "stale"
          ]
        }
      },
      "additionalProperties": false
    },
    "source_ids": {
      "type": "array",
      "uniqueItems": true,
      "items": {
        "$ref": "common.schema.json#/$defs/stableId"
      }
    },
    "unknowns": {
      "type": "array",
      "items": {
        "type": "string",
        "minLength": 1
      }
    },
    "reviewed_at": {
      "$ref": "common.schema.json#/$defs/isoDateOrTimestamp"
    },
    "review_after": {
      "$ref": "common.schema.json#/$defs/isoDateOrTimestamp"
    },
    "notes": {
      "type": "string"
    }
  },
  "additionalProperties": false
}
