{
  "schema_version": "0.1.0",
  "country_id": "country_twn",
  "country_code": "TWN",
  "name": "Taiwan",
  "bookmark_id": "bookmark_global_fracture_2026_07_01",
  "as_of": "2026-07-01T00:00:00Z",
  "depth_tier": "A",
  "coverage_status": "collecting",
  "roster_basis": "top_80_2025_nominal_gdp",
  "gdp_rank": 22,
  "gdp_2025_usd_billions": 920.05,
  "coverage": {
    "politics_and_institutions": {
      "status": "shell",
      "record_count": 0,
      "source_count": 0,
      "open_question_count": 1,
      "notes": "Coverage has not begun."
    },
    "economy_trade_finance_resources": {
      "status": "collecting",
      "record_count": 1,
      "source_count": 1,
      "open_question_count": 5,
      "notes": "The frozen 2025 nominal GDP cohort record is linked; the campaign economy remains unpopulated."
    },
    "military_organization_inventory": {
      "status": "shell",
      "record_count": 0,
      "source_count": 0,
      "open_question_count": 8,
      "notes": "The force ledger manifest exists, but no organization or inventory claims are accepted yet."
    },
    "fixed_facilities_basing": {
      "status": "shell",
      "record_count": 0,
      "source_count": 0,
      "open_question_count": 1,
      "notes": "Coverage has not begun."
    },
    "strategic_industry_conversion": {
      "status": "shell",
      "record_count": 0,
      "source_count": 0,
      "open_question_count": 1,
      "notes": "Coverage has not begun."
    },
    "energy_transport_communications_logistics": {
      "status": "shell",
      "record_count": 0,
      "source_count": 0,
      "open_question_count": 1,
      "notes": "Coverage has not begun."
    },
    "geography_provinces_terrain": {
      "status": "shell",
      "record_count": 0,
      "source_count": 0,
      "open_question_count": 1,
      "notes": "Coverage has not begun."
    },
    "crises_alliances_sanctions_deployments": {
      "status": "shell",
      "record_count": 0,
      "source_count": 0,
      "open_question_count": 1,
      "notes": "Coverage has not begun."
    }
  },
  "dataset_paths": {
    "government": null,
    "political_actors": null,
    "provinces": null,
    "economy": "../top_80_2025/top_80_2025_gdp.json",
    "force_ledger": "force_ledger/manifest.json",
    "facilities": null,
    "infrastructure": null,
    "relationships": null,
    "claims": null,
    "sources": "../../sources/sources.ndjson",
    "contradictions": null
  },
  "completeness": {
    "political_actor_target": 20,
    "political_actor_count": 0,
    "province_layer_status": "absent",
    "force_ledger_status": "shell"
  },
  "source_ids": [
    "src_imf_weo_2026_04_ngdpd_2025"
  ],
  "unknowns": [
    "National government and leadership state at the bookmark is not yet populated.",
    "Twenty plausible political actors and constitutional succession paths are not yet populated.",
    "County, city, island, base, port, and critical corridor strategic geography is not yet populated.",
    "Complete armed forces, reserve, coast guard, inventory, readiness, basing, and deployment records are not yet reconciled.",
    "Strategic industry, energy, transport, communications, logistics, alliances, sanctions, and crisis commitments are not yet populated."
  ],
  "reviewed_at": "2026-08-02",
  "review_after": "2026-08-16",
  "notes": "This is a truthful Tier A foundation, not a completeness claim. New files are added only when sourced records exist."
}
