{
  "schema_version": "0.1.0",
  "country_id": "country_syr",
  "country_code": "SYR",
  "name": "Syria",
  "bookmark_id": "bookmark_global_fracture_2025_09_01",
  "as_of": "2025-09-01T00:00:00Z",
  "depth_tier": "C",
  "coverage_status": "shell",
  "roster_basis": "mandatory_strategic_addition",
  "gdp_rank": null,
  "gdp_2025_usd_billions": null,
  "coverage": {
    "politics_and_institutions": {
      "status": "shell",
      "record_count": 0,
      "source_count": 0,
      "open_question_count": 1,
      "notes": "No sourced records are accepted yet; zero is corpus completeness, not real world quantity."
    },
    "economy_trade_finance_resources": {
      "status": "shell",
      "record_count": 0,
      "source_count": 0,
      "open_question_count": 1,
      "notes": "No sourced records are accepted yet; zero is corpus completeness, not real world quantity."
    },
    "military_organization_inventory": {
      "status": "shell",
      "record_count": 0,
      "source_count": 0,
      "open_question_count": 1,
      "notes": "No sourced records are accepted yet; zero is corpus completeness, not real world quantity."
    },
    "fixed_facilities_basing": {
      "status": "shell",
      "record_count": 0,
      "source_count": 0,
      "open_question_count": 1,
      "notes": "No sourced records are accepted yet; zero is corpus completeness, not real world quantity."
    },
    "strategic_industry_conversion": {
      "status": "shell",
      "record_count": 0,
      "source_count": 0,
      "open_question_count": 1,
      "notes": "No sourced records are accepted yet; zero is corpus completeness, not real world quantity."
    },
    "energy_transport_communications_logistics": {
      "status": "shell",
      "record_count": 0,
      "source_count": 0,
      "open_question_count": 1,
      "notes": "No sourced records are accepted yet; zero is corpus completeness, not real world quantity."
    },
    "geography_provinces_terrain": {
      "status": "shell",
      "record_count": 0,
      "source_count": 0,
      "open_question_count": 1,
      "notes": "No sourced records are accepted yet; zero is corpus completeness, not real world quantity."
    },
    "crises_alliances_sanctions_deployments": {
      "status": "shell",
      "record_count": 0,
      "source_count": 0,
      "open_question_count": 1,
      "notes": "No sourced records are accepted yet; zero is corpus completeness, not real world quantity."
    }
  },
  "dataset_paths": {
    "government": null,
    "political_actors": null,
    "provinces": null,
    "economy": null,
    "force_ledger": null,
    "facilities": null,
    "infrastructure": null,
    "relationships": null,
    "claims": null,
    "sources": "../../sources/sources.ndjson",
    "contradictions": null
  },
  "completeness": {
    "political_actor_target": 20,
    "political_actor_count": 0,
    "province_layer_status": "absent",
    "force_ledger_status": "absent"
  },
  "source_ids": [],
  "unknowns": [
    "The registry establishes identity and required campaign coverage only; it does not establish country conditions at the bookmark.",
    "Government, leadership, institutions, and political actors at the bookmark are unknown in this shell.",
    "Economy, trade, finance, resources, and industrial capacity are unknown in this shell; missing GDP fields do not assert zero output.",
    "Military organization, inventory, readiness, basing, maintenance, and deployments are unknown in this shell.",
    "Province, terrain, infrastructure, industry, energy, logistics, and communications state are unknown in this shell.",
    "Alliances, dependencies, sanctions, crisis commitments, and active plans are unknown in this shell.",
    "A zero record count means no accepted corpus records and never asserts zero real world entities or capacity."
  ],
  "notes": "Generated from the approved strategic addition registry only. Numeric coverage zeros count accepted corpus records and never assert real world absence. All substantive country facts remain unknown until sourced."
}
